{
  "kind": "aziel-runtime.clean-room-2.0",
  "runtime_version": "2.0.0-rc1",
  "git_sha": "aaaaaaaaaaaaaaaaaaaaaaaaaaaaaaaaaaaaaaaa",
  "author": "Aziel Eliab",
  "identity": "Aziel Eliab",
  "generated_at": "2026-09-11T00:00:00.000Z",
  "verdict": "PASS",
  "steps": [
    { "id": "install", "name": "npm install", "status": "PASS", "detail": "omit-optional not required" },
    { "id": "npm_test", "name": "npm test", "status": "PASS", "detail": "exit 0" },
    { "id": "docker_or_local", "name": "docker build/run or documented local", "status": "SKIP", "detail": "docker unavailable; used AZIEL_RUNTIME_MCP=local" },
    { "id": "mcp_initialize", "name": "MCP initialize", "status": "PASS", "detail": "protocolVersion 2025-03-26" },
    { "id": "tools_list", "name": "MCP tools/list", "status": "PASS", "detail": "36 PUBLIC_MCP_TOOLS" },
    { "id": "harmless_call", "name": "fraggate_call decisiongate health", "status": "PASS", "detail": "FG-OK" },
    { "id": "receipt_verify", "name": "session receipt verifyChainStrict", "status": "PASS", "detail": "chain_ok" },
    { "id": "shutdown", "name": "session close / process exit", "status": "PASS", "detail": "closed" }
  ],
  "mcp": {
    "protocol_version": "2025-03-26",
    "server_name": "aziel-runtime",
    "server_version": "2.0.0-rc1",
    "tools_list_count": 36,
    "tools_list_names": [
      "runtime_skill",
      "fraggate_list",
      "fraggate_describe",
      "fraggate_verify",
      "fraggate_call",
      "decisiongate_check",
      "library_lookup",
      "mesh_status",
      "mesh_enable",
      "mesh_disable",
      "mesh_join",
      "mesh_heartbeat",
      "mesh_leave",
      "mesh_nodes",
      "mesh_broadcast",
      "chainlock_append",
      "chainlock_tip",
      "chainlock_recall",
      "chainlock_verify",
      "chainlock_seal",
      "memory_observe",
      "memory_resolve",
      "memory_calibrate",
      "memory_recall",
      "memory_get",
      "Softwares",
      "runtime_bundle",
      "runtime_pull",
      "runtime_run",
      "runtime_manifest",
      "runtime_session_open",
      "runtime_session_policy",
      "runtime_session_exec",
      "runtime_session_receipt",
      "runtime_session_receipts",
      "runtime_session_close"
    ],
    "harmless_call": {
      "slug": "decisiongate",
      "op": "health",
      "ok": true,
      "code": "FG-OK"
    }
  },
  "receipt": {
    "kind": "aziel-runtime.receipt",
    "session_id": "sess_00000000000000000000000000000000",
    "chain_ok": true,
    "count": 3
  },
  "docker": {
    "attempted": false,
    "available": false,
    "status": "SKIP",
    "detail": "sample only — not a live run"
  },
  "npm_test": "pass",
  "third_party_lab": false,
  "court_audit": false,
  "remain_off_untouched": true,
  "fraggate_single_door": true,
  "mesh_get_never_enables": true,
  "secrets_required": false,
  "note": "Sample evidence object for schema review. A live run replaces git_sha / generated_at / result_sha256. Not a third-party lab.",
  "result_sha256": "0000000000000000000000000000000000000000000000000000000000000000"
}
